<?xml version="1.0" encoding="UTF-8"?>
<obrazac_saglasnosti_za_imunizaciju xmlns="http://www.ftn.uns.ac.rs/saglasnost"
    xmlns:xsi="http://www.w3.org/2001/XMLSchema-instance"
    xsi:schemaLocation="http://www.ftn.uns.ac.rs/saglasnost saglasnost.xsd" 
    datum="2021-06-11">
    <informacije_o_pacijentu>
        <drzavljanstvo>
            <srpsko_drzavljanstvo>
                <jmbg>1234567890123</jmbg>
            </srpsko_drzavljanstvo>
            <strano_drzavljanstvo>
                <naziv_stranog_drzavljanstva>Austrija</naziv_stranog_drzavljanstva>
                <broj_pasosa_ili_ebs>123456489</broj_pasosa_ili_ebs>
            </strano_drzavljanstvo>
        </drzavljanstvo>
        <puno_ime>
            <prezime>Petrov</prezime>
            <licno_ime>Dina</licno_ime>
            <ime_roditelja>Branislav</ime_roditelja>
        </puno_ime>
        <pol>Å½</pol>
        <datum_i_mesto_rodjenja>
            <datum_rodjenja>1999-06-04</datum_rodjenja>
            <mesto_rodjenja>Zrenjanin</mesto_rodjenja>
        </datum_i_mesto_rodjenja>
        <prebivaliste>
            <ulica>Bulevar Despota Stefana</ulica>
            <broj>7a</broj>
            <mesto>Novi Sad</mesto>
            <opstina>Novi Sad</opstina>
        </prebivaliste>
        <kontakt_informacije>
            <fiksni_telefon>111111111</fiksni_telefon>
            <mobilni_telefon>1111111111</mobilni_telefon>
            <email_adresa>xxxxxx@xxxx.com</email_adresa>
        </kontakt_informacije>
        <radni_status>student</radni_status>
        <zanimanje_zaposlenog></zanimanje_zaposlenog>
        <ustanova_socijalne_zastite>
            <pacijent_koristi_zastitu>true</pacijent_koristi_zastitu>
            <naziv_sedista></naziv_sedista>
            <opstina_sedista></opstina_sedista>
        </ustanova_socijalne_zastite>
        <izjava_saglasnosti>
            <saglasan>true</saglasan>
            <naziv_imunoloskog_leka></naziv_imunoloskog_leka>
        </izjava_saglasnosti>
    </informacije_o_pacijentu>
    <evidencija_o_vakcinaciji>
        <zdravstvena_ustanova>
            <naziv></naziv>
            <vakcinacijski_punkt></vakcinacijski_punkt>
            <informacije_o_lekaru>
                <ime></ime>
                <prezime></prezime>
                <faksimil></faksimil>
                <broj_telefona></broj_telefona>
            </informacije_o_lekaru>
        </zdravstvena_ustanova>
        <izvrsena_imunizacija>
            <vakcina>
                <broj_doze>1</broj_doze>
                <naziv>AstraZeneca</naziv>
                <datum_davanja>2021-04-04</datum_davanja>
                <nacin_davanja>IM</nacin_davanja>
                <ekstremitet>LR</ekstremitet>
                <serija>43872</serija>
                <proizvodjac>AstraZeneca</proizvodjac>
                <nezeljena_reakcija></nezeljena_reakcija>
            </vakcina>
            <vakcina>
                <broj_doze>2</broj_doze>
                <naziv>AstraZeneca</naziv>
                <datum_davanja>2021-06-04</datum_davanja>
                <nacin_davanja>IM</nacin_davanja>
                <ekstremitet>LR</ekstremitet>
                <serija>93872</serija>
                <proizvodjac>AstraZeneca</proizvodjac>
                <nezeljena_reakcija></nezeljena_reakcija>
            </vakcina>
        </izvrsena_imunizacija>
        <kontraindikacija>
            <privremene_kontraindikacije>
                <datum_utvrdjivanja></datum_utvrdjivanja>
                <dijagnoza></dijagnoza>
            </privremene_kontraindikacije>
            <trajne_kontraindikacije>
                <odluka_komisije></odluka_komisije>
            </trajne_kontraindikacije>
        </kontraindikacija> 
    </evidencija_o_vakcinaciji>
</obrazac_saglasnosti_za_imunizaciju>

